{"combat_progression":{"awarded":0,"rationale":"No executable combat or progression is present or demonstrated.","evidence":["/workspaces/shootemup-benchmark/candidates/monolith_luna_max_opencode_speckit/src/App.tsx:1-8 renders only placeholder text.","/workspaces/shootemup-benchmark/results/evidence/monolith_luna_max_opencode_speckit/test.log:13-20,32-56 reports missing engine and collision modules."]},"visual_design":{"awarded":0,"rationale":"The implemented UI is only a minimal placeholder, with no game visuals, feedback, or retained screenshots.","evidence":["/workspaces/shootemup-benchmark/candidates/monolith_luna_max_opencode_speckit/src/styles.css:1-40 contains only basic page styling.","/workspaces/shootemup-benchmark/results/evidence/monolith_luna_max_opencode_speckit/browser-evaluator.log:18-20 shows evaluation stopped before browser screenshots were captured."]},"resilience_accessibility":{"awarded":0,"rationale":"A generic status component exists but is not integrated into the placeholder application, and no runtime accessibility or failure-state evidence exists.","evidence":["/workspaces/shootemup-benchmark/candidates/monolith_luna_max_opencode_speckit/src/components/StatusMessage.tsx:7-17 defines status/retry semantics, but /src/App.tsx:1-8 does not render it.","/workspaces/shootemup-benchmark/results/evidence/monolith_luna_max_opencode_speckit/automated.json:15-20 contains no browser evaluation evidence."]},"data_security":{"awarded":0,"rationale":"The migration is statically well-scoped, but the protocol requires a remote behavior check; none was run, so deployed security cannot be credited.","evidence":["/workspaces/shootemup-benchmark/candidates/monolith_luna_max_opencode_speckit/supabase/migrations/20260806_create_leaderboard_entries.sql:1-30 contains constraints, RLS, restricted grants, and select/insert policies.","/workspaces/shootemup-benchmark/candidates/monolith_luna_max_opencode_speckit/.env.example:1-2 exposes only public Supabase variables.","/workspaces/shootemup-benchmark/benchmark/protocol.md:130-135 requires migration inspection plus remote behavior evidence; /workspaces/shootemup-benchmark/results/evidence/monolith_luna_max_opencode_speckit/automated.json:15-20 records no Supabase requests and an aborted browser evaluation."]},"engineering_quality":{"awarded":1,"rationale":"Exact dependency pins, a lockfile, and a clean lint run earn minimal credit; the build/typecheck fail and the automated suites cannot resolve core modules.","evidence":["/workspaces/shootemup-benchmark/candidates/monolith_luna_max_opencode_speckit/package.json:16-34 and package-lock.json:1-28 show pinned dependencies and lockfileVersion 3.","/workspaces/shootemup-benchmark/results/evidence/monolith_luna_max_opencode_speckit/lint.exit-code:1 is 0 and lint.log:2-4 is clean.","/workspaces/shootemup-benchmark/results/evidence/monolith_luna_max_opencode_speckit/build.log:2-8 and typecheck.log:2-8 show TypeScript failures; test.log:11-56 shows both suites failed with zero tests."]},"reproducibility":{"awarded":3,"rationale":"The migration, locked dependency set, and detailed quickstart/specification artifacts provide partial handoff value. README, deployment verification tooling, result artifact, and successful release evidence are absent.","evidence":["/workspaces/shootemup-benchmark/candidates/monolith_luna_max_opencode_speckit/specs/001-neon-barrage-shooter/quickstart.md:1-19,30-51,76-127 documents setup, checks, migration, deployment, and production verification.","/workspaces/shootemup-benchmark/candidates/monolith_luna_max_opencode_speckit/supabase/migrations/20260806_create_leaderboard_entries.sql and package-lock.json:1-28 are reproducibility inputs.","/workspaces/shootemup-benchmark/results/evidence/monolith_luna_max_opencode_speckit/source-manifest.txt:1-71 contains no README.md, verification script, or benchmark-result.json; browser-evaluator.log:18-20 confirms the missing result artifact."]},"manual_points":4,"summary":"Manual award: 4/46. The retained tree is an incomplete foundation with no demonstrated game, UI, deployment, or remote Supabase behavior."}