{"combat_progression":{"awarded":5,"rationale":"Full credit for meaningful combat variety and escalation.","evidence":["src/game.ts:252-305 defines scout, zig, and tank enemies with distinct HP, movement, and point values; src/game.ts:320-331 gives tanks return fire.","src/game.ts:171-189 and 359-413 implement increasing difficulty, projectiles, collisions, scoring, lives, invulnerability, and game over.","results/evidence/monolith_auto_cursor/automated.json:105-145 records three spawned enemies and the game-over adapter state."]},"visual_design":{"awarded":11,"rationale":"Cohesive neon art direction, strong hierarchy, responsive layout, and implemented visual feedback; one point withheld because the retained playing screenshot shows a mostly empty canvas without visible combat effects.","evidence":["desktop-before.png visibly shows cyan/magenta branding, structured HUD, overlay panel, leaderboard card, and consistent dark neon styling.","mobile.png visibly shows a readable stacked layout with D-pad, FIRE control, leaderboard, and instructions without clipping.","src/render.ts:29-152 implements moving stars, grid, colored ships/projectiles, particles, screen shake, hit flash, and invulnerability blinking; src/style.css:25-181 and 352-369 implement gradients, glow, responsive layout, and animation."]},"resilience_accessibility":{"awarded":2,"rationale":"Loading, empty, missing-configuration, network-error, validation, and submission-error states are implemented, with basic labels and focus styling.","evidence":["src/main.ts:155-172 handles missing configuration, loading, network errors, empty results, and successful refresh status.","src/main.ts:222-246 handles validation/submission failures and restores the submit control; src/main.ts:56-72 provides a labeled input and ARIA labels.","results/evidence/monolith_auto_cursor/automated.json:239-268 reports accessible labels and no console or page errors."]},"data_security":{"awarded":9,"rationale":"The migration provides strong database-side validation, RLS, and least-privilege public grants, and the evaluator confirms the live anonymous read/insert path. One point is withheld because retained remote logs do not test denied updates/deletes or invalid-row rejection.","evidence":["supabase/migrations/20260807190000_leaderboard.sql:5-18 defines name and score constraints; lines 23-47 enable RLS, add select/insert policies, revoke update/delete, and grant only select/insert.","src/config.ts:1-5 and src/leaderboard.ts:18-65 use the Supabase URL plus anon key for read/insert only; no privileged browser credential is referenced.","results/evidence/monolith_auto_cursor/automated.json:147-205 and 273-293 record live anonymous GET 200 and POST 201 requests with reload persistence."]},"engineering_quality":{"awarded":9,"rationale":"Build, typecheck, lint, and tests pass; dependencies are pinned and the code is sensibly separated into simulation, rendering, audio, UI, and data modules. One point is withheld for limited local coverage and a lint script that duplicates typechecking.","evidence":["results/evidence/monolith_auto_cursor/build.log:2-13 shows a successful TypeScript/Vite production build; typecheck.log, lint.log, and their exit-code files are successful.","results/evidence/monolith_auto_cursor/test.log:2-13 reports 9 passing Vitest tests.","package.json:6-23 pins direct dependency versions and package-lock.json:1-17 records lockfileVersion 3; tsconfig.json:3-20 enables strict and unused-code checks."]},"reproducibility":{"awarded":7,"rationale":"Complete handoff beyond the result artifact: setup, commands, controls, architecture, deployment, security decisions, migration location, and test-adapter usage are documented and retained with the source.","evidence":["README.md:5-39 documents local setup, commands, controls, architecture, and public-environment security decisions.","README.md:41-76 documents the migration, Supabase and Cloudflare deployment steps, and test adapter behavior.","supabase/migrations/20260807190000_leaderboard.sql, package-lock.json, source-manifest.txt, and the retained build/test logs provide reproducible source, schema, dependency, and verification artifacts."]},"manual_points":43,"summary":"Automated evidence records 54 points; manual evidence judgment awards 43 of 46, for an evidence-backed total of 97/100."}