{"combat_progression":{"awarded":5,"rationale":"Strong arcade depth beyond the basic loop: elite multi-hit enemies, aimed enemy fire, combo scoring, particles, lives/invulnerability, and timed difficulty escalation are implemented and visibly represented.","evidence":["src/engine.js:20-27 defines elite enemies with 3 HP; src/engine.js:50-76 increases level, spawn rate, enemy count, and shot speed.","src/engine.js:85-97 implements collisions, combo score, bursts, shake, cleanup, and player damage.","automated.json:105-116 records spawned enemies and score 110; desktop-after.png visibly shows active play with the ship, enemy, grid, and HUD."]},"visual_design":{"awarded":11,"rationale":"Cohesive, deliberate synthwave presentation with strong hierarchy, responsive composition, custom canvas art, glow, grid, particles, and game-over feedback. Minor deduction for low-contrast microcopy and CSP-blocked inline leaderboard styling.","evidence":["desktop-before.png and desktop-after.png visibly show the neon cyan/magenta palette, framed HUD, perspective grid, animated-play state, ship, enemy, and leaderboard hierarchy.","mobile.png visibly shows a coherent narrow layout with stacked panels, touch controls, readable score/shields, and the same visual system.","src/main.js:94-136 implements gradients, perspective grid, stars, glows, enemy/projectile art, particles, invulnerability flicker, and player rendering; src/style.css:10-36 defines the responsive visual system.","automated.json:216-228 confirms the mute UI changes; automated.json:251-276 records CSP inline-style console errors."]},"resilience_accessibility":{"awarded":2,"rationale":"The residual feature set is well covered: loading, empty, configuration, retry, network-error, validation, live-region, labels, focus styling, and reduced-motion handling are present. The retained CSP console errors are a quality issue but did not make the game unusable.","evidence":["src/main.js:156-170 provides loading, configuration-unavailable, empty, network-error, and retry states while explicitly keeping the game available; src/main.js:176-188 validates and re-enables failed submissions.","index.html:13-18,28-31,44-60,65-70 contains labels, aria attributes, aria-live, and labeled touch controls; src/style.css:30-36 includes focus and reduced-motion rules.","automated.json:216-260 records accessible-label and mobile-fit checks; automated.json:251-276 records no page errors but repeated CSP console errors."]},"data_security":{"awarded":9,"rationale":"The checked-in schema is security-conscious and the live evaluator confirms the intended public read/insert path. One point is withheld because retained evidence does not show remote rejection tests for unauthorized update/delete or invalid payloads, so deployed RLS enforcement cannot be fully inferred from the migration alone.","evidence":["supabase/migrations/20260805225333_create_leaderboard.sql:6-17 defines constraints, RLS, revokes, and only SELECT/INSERT grants; lines 19-32 define the read and constrained insert policies.","src/main.js:21-22,152-153 uses only VITE public configuration; .env.production:1-2 and benchmark-result.json:6-8 expose a publishable key, not a service-role secret.","automated.json:147-205 and browser-evaluator.log:291-310 record live Supabase GET 200, POST 201, and reload GET 200 requests; no negative security probe is retained.","public/_headers:2-6 adds nosniff, frame, permissions, and restrictive CSP headers."]},"engineering_quality":{"awarded":8,"rationale":"Good structure and baseline verification: the engine is separated from rendering/input, dependencies are pinned, four meaningful engine tests pass, and the production build is clean. Deductions reflect the small test suite, no lint/typecheck, dense one-line styling/code, and the known CSP warning.","evidence":["test.log:2-16 records 4 passing Node tests covering initial state, bounded movement/twin firing, collision/scoring, and validated game-over.","build.log:2-13 records a successful Vite 7.0.6 production build; build.exit-code is 0.","package.json:6-16 pins Vite/Wrangler and defines test/build scripts; package-lock.json:1-13 is lockfileVersion 3 with matching pinned dependencies.","src/engine.js, src/main.js, and src/style.css show a clear engine/DOM-renderer/style split; automated.json:251-276 records the remaining browser CSP errors."]},"reproducibility":{"awarded":6,"rationale":"Strong handoff beyond the result artifact: README, migration, environment template, deployment config, lockfile, tests, and retained build/test evidence are present. One point is withheld for the incomplete local seed configuration and lack of a retained remote security/verification transcript beyond the browser round trip.","evidence":["README.md:5-21 documents setup and quality checks; lines 23-42 document controls, architecture, migration/security decisions; lines 44-60 document deployment and the test adapter.","supabase/migrations/20260805225333_create_leaderboard.sql is a reproducible schema/policy migration; package-lock.json:1-13 pins the dependency graph.","wrangler.jsonc:1-6 and .env.example:1-2 provide deployment/environment configuration; source-manifest.txt:1-25 lists the retained source, migration, tests, build output, and screenshots.","supabase/config.toml:59-71 enables a missing ./seed.sql path, and no separate retained remote security probe is present."]},"manual_points":41,"summary":"Manual score 41/46. The candidate is visually polished with a deeper-than-minimal combat loop and strong checked-in security/reproducibility artifacts; deductions are for unverified negative remote security behavior, limited automated coverage, CSP console errors, and a minor handoff gap."}