{"combat_progression":{"awarded":4,"rationale":"The source implements enemies, player and enemy projectiles, collision scoring, lives, invulnerability, game-over, and a continuous difficulty ramp. Progression is modest and the evaluator log does not directly capture hit/life-loss behavior or distinct waves.","evidence":["src/game.ts:142-179, 205-255 — difficulty scaling, two enemy sizes, spawning, and enemy shots.","src/game.ts:272-305 — collision scoring, damage, lives, invulnerability, effects, and game-over.","results/evidence/monolith_grok_4_5_medium_cursor/automated.json — evaluator observed playing state, firing, and enemyCount increasing from 1 to 4."]},"visual_design":{"awarded":10,"rationale":"Strong, coherent neon arcade art direction with clear desktop/mobile hierarchy and responsive controls. The screenshots do not visibly demonstrate an explosion or hit-feedback moment, so not all feedback points are awarded.","evidence":["desktop-before.png and desktop-after.png visibly show the cyan/magenta/lime palette, gradient title, HUD, framed canvas, scanlines, starfield, and glowing player.","mobile.png visibly shows a clean narrow layout with usable d-pad and large FIRE control without clipping.","src/style.css:50-125, 165-205, 271-325 — typography, gradients, panel styling, hover effects, touch layout, and responsive breakpoint.","src/game.ts:315-393 — rendered glow, scanlines, particles, enemy/projectile styling, and screen shake."]},"resilience_accessibility":{"awarded":2,"rationale":"Loading, empty, and network-error states are explicitly handled, and the UI exposes useful canvas, control, touch, and mute labels while remaining playable on leaderboard failure.","evidence":["src/main.ts:110-143 — empty, loading, and leaderboard error rendering/status handling.","src/main.ts:28, 49-56, 74-77, 182-187 — canvas/control labels, touch controls, name input, submit state, and aria-pressed mute state.","results/evidence/monolith_grok_4_5_medium_cursor/automated.json — browser evaluator recorded labeledElements=5 and no console or page errors."]},"data_security":{"awarded":9,"rationale":"The migration provides RLS, constrained database validation, public read/insert policies, and revoked update/delete privileges; the client uses the anon key path only. One point is withheld because retained remote evidence does not include a direct denied update/delete or invalid-insert probe.","evidence":["supabase/migrations/001_leaderboard.sql:2-10, 16-36 — table constraints, RLS, policies, grants, and update/delete revocation.","src/leaderboard.ts:30-36, 54-71 — browser client configuration and validated insert/read operations using VITE_SUPABASE_ANON_KEY.","results/evidence/monolith_grok_4_5_medium_cursor/automated.json — live Supabase GET requests returned 200 and the UI POST returned 201, with reload reads succeeding.","README.md:47-54 — documented security decisions consistent with the checked-in source and migration."]},"engineering_quality":{"awarded":8,"rationale":"The implementation is typed and modular, with strict compiler settings, a passing production build, passing typecheck/lint commands, and seven meaningful unit tests. Points are deducted for shallow collision/lifecycle/integration coverage and a lockfile whose root metadata and TypeScript constraint do not match package.json.","evidence":["results/evidence/monolith_grok_4_5_medium_cursor/build.log and build.exit-code — production build completed successfully with exit code 0.","results/evidence/monolith_grok_4_5_medium_cursor/test.log and test.exit-code — 1 test file and 7 tests passed with exit code 0.","results/evidence/monolith_grok_4_5_medium_cursor/typecheck.log, lint.log, typecheck.exit-code, and lint.exit-code — both checks passed.","tsconfig.json:11-18 and src/game.ts, src/main.ts, src/leaderboard.ts, src/audio.ts — strict TypeScript and separated game/UI/data/audio modules.","package.json:14-22 versus package-lock.json:2-18, 2240-2244 — dependency metadata is inconsistent, including package name/version and TypeScript 5.6.3 versus the declared ~5.7.2."]},"reproducibility":{"awarded":6,"rationale":"The handoff is substantially reproducible: README setup/deployment instructions, environment template, migration SQL, Wrangler configuration, source manifest, and retained build/test logs are present. One point is withheld for the stale/inconsistent lockfile.","evidence":["README.md:5-65 — local setup, commands, controls, architecture, deployment, security, and test-adapter documentation.","supabase/migrations/001_leaderboard.sql — checked-in schema and policy reproduction artifact.",".env.example, wrangler.toml, and source-manifest.txt — environment template, deployment configuration, and retained source/build inventory.","results/evidence/monolith_grok_4_5_medium_cursor/build.log, test.log, typecheck.log, and browser-evaluator.log — factual verification records.","package-lock.json:2-18, 2240-2244 — present but not synchronized with package.json, reducing clean-install reproducibility."]},"manual_points":39,"summary":"Manual evidence-supported score: 39/46; combined with the recorded 54 automated points, 93/100."}