{"combat_progression":{"awarded":4,"rationale":"The source implements enemy variants, projectile collision, scoring, escalating spawn/speed, lives, invulnerability, game over, and restart. Retained browser evidence proves start, movement, firing, spawning, adapter game over, and restart, but not a real hit/score change or natural lives exhaustion.","evidence":["src/main.js:105-151 and src/game-core.js:8-14","results/evidence/monolith_sol_medium_opencode/automated.json: game_starts, keyboard_movement, keyboard_fire, enemies_spawn, game_over_adapter_uses_real_state, restart","desktop-after.png visibly shows the active ship, enemy, threat HUD, and moving barrage field"]},"visual_design":{"awarded":12,"rationale":"Full credit for a coherent neon arcade art direction, strong hierarchy, responsive composition, and implemented animation/audio feedback.","evidence":["desktop-before.png shows the cyan/magenta title treatment, HUD, overlay card, leaderboard, score form, and manual panels","desktop-after.png shows the active ship, pink drone, cyan streaks, grid field, and threat state","mobile.png shows the responsive stacked layout with visible D-pad and FIRE controls","src/style.css and src/main.js:154-175 implement gradients, glow, particles, screen shake, rotating enemies, engine flame animation, and canvas feedback"]},"resilience_accessibility":{"awarded":2,"rationale":"Explicit loading, offline, empty, network-error, validation, transmitting, and retry states are present, with readable controls and core labels.","evidence":["src/main.js:192-214 handles loading, missing configuration, empty results, fetch errors, validation, and retry","src/main.js:9,18,28 provides aria labels for the mute button, canvas, and player-name input","results/evidence/monolith_sol_medium_opencode/automated.json: basic_accessible_labels and browser_error_free passed with no console or page errors"]},"data_security":{"awarded":10,"rationale":"The checked-in migration provides RLS, constrained database-side validation, and only public SELECT/INSERT access; browser code uses environment-injected public credentials only. The retained live evaluator confirms the permitted remote read/insert path and reload persistence.","evidence":["supabase/migrations/20260806000000_leaderboard.sql:1-33 defines constraints, enables RLS, creates SELECT/INSERT policies, revokes table access, and grants only SELECT/INSERT","src/main.js:4-5,197,211 and .env.example:1-2 use only the Supabase URL and public key","results/evidence/monolith_sol_medium_opencode/automated.json: leaderboard_ui_submission and leaderboard_reload_persistence record live GET 200, POST 201, and subsequent GET 200 requests"]},"engineering_quality":{"awarded":8,"rationale":"The project has a pinned lockfile, passing build, typecheck, focused gameplay-rule tests, a separate testable game-core module, and a production smoke test. Coverage is limited to three unit tests, typecheck targets only game-core.js, and no lint script is present.","evidence":["package.json defines build, test, typecheck, and test:production scripts","package-lock.json:1-15 pins Playwright, TypeScript, Vite, and Vitest","results/evidence/monolith_sol_medium_opencode/build.log and build.exit-code show a successful Vite build with exit code 0","results/evidence/monolith_sol_medium_opencode/test.log and test.exit-code show 3 passing tests; typecheck.log and typecheck.exit-code also pass","src/game-core.test.js contains collision, difficulty, and validation tests"]},"reproducibility":{"awarded":7,"rationale":"The handoff is complete beyond the result artifact: local setup, controls, architecture, security, deployment guidance, environment template, migration, lockfile, and an executable production smoke test are all present.","evidence":["README.md:5-30 documents setup, controls, architecture, security, quality checks, and deployment",".env.example provides the required configuration shape","supabase/migrations/20260806000000_leaderboard.sql reproduces the database schema and policies","tests/production-smoke.mjs:1-39 exercises production HTTP, selectors, gameplay, score submission, and mobile visibility","results/evidence/monolith_sol_medium_opencode/source-manifest.txt lists the retained source, migration, tests, README, and lockfile"]},"manual_points":43,"summary":"Manual remainder: 43/46. The retained automated evaluator reports 54/54 separately."}