{"combat_progression":{"awarded":5,"rationale":"The source shows a complete combat loop with multiple enemy behaviors, enemy fire, collision scoring, lives damage, and score/time-based escalation; evaluator evidence confirms spawning and firing.","evidence":["src/main.js:263-277 defines drone, weaver, and hunter enemies; lines 361-371 add distinct movement and difficulty-gated enemy shots.","src/main.js:382-415 handles projectile collisions, type-based scoring, missed-enemy damage, and life loss; src/gameLogic.js:28-37 tightens waves and spawn timing.","results/evidence/monolith/automated.json records keyboard_fire projectileCount 1 and enemies_spawn enemyCount 4."]},"visual_design":{"awarded":12,"rationale":"Desktop and mobile screenshots show a cohesive neon orbital visual system with strong hierarchy, responsive composition, readable HUD/leaderboard treatment, and visible game-state styling. Source adds animated stars, glow, particles, projectiles, hit flash, and screen shake.","evidence":["results/evidence/monolith/desktop-before.png and desktop-after.png show consistent cyan/pink neon branding, framed canvas, HUD, leaderboard hierarchy, and a visible transition from mission overlay to active battlefield.","results/evidence/monolith/mobile.png shows a clean single-column layout with readable typography, touch controls, and leaderboard reflow.","src/main.js:427-594 implements gradients, starfield, orbital rings, glowing player/enemy/projectile art, particles, hit flash, and shake; src/styles.css:55-60,82,99-100,168,199-200 adds glow, animation, hover, and reduced-motion styling."]},"resilience_accessibility":{"awarded":2,"rationale":"The app has explicit offline, loading, empty, validation, and upload-error states, plus labeled controls, focus styling, status regions, touch labels, and reduced-motion support.","evidence":["src/main.js:640-702 handles missing configuration, syncing, empty results, read failures, invalid callsigns/scores, loading, and insert failures without disabling gameplay.","src/main.js:21-30,55,67-83,95-97 provides labels, status roles, canvas labeling, form labeling, and touch-button aria-labels; src/styles.css:36 and 199-200 provide focus-visible and reduced-motion behavior.","results/evidence/monolith/automated.json records basic_accessible_labels labeledElements 7 and browser_error_free with no console or page errors."]},"data_security":{"awarded":10,"rationale":"The checked-in migration enables RLS, restricts public table privileges to SELECT/INSERT, enforces database-side name and score constraints, and the browser uses only public Supabase configuration. Retained remote evidence confirms the intended public read/insert path and persistence.","evidence":["supabase/migrations/20260805143000_create_leaderboard.sql:5-21 defines constrained columns, an index, and enabled RLS; lines 23-43 define only validated SELECT/INSERT policies and revoke other table privileges.","src/main.js:134-136 reads only VITE_SUPABASE_URL and VITE_SUPABASE_PUBLISHABLE_KEY; line 690 performs the client insert through the constrained table.","results/evidence/monolith/automated.json records Supabase GET 200 and POST 201 requests, leaderboard_reload_persistence persisted true, and benchmark-result.json records the verified RLS leaderboard round trip."]},"engineering_quality":{"awarded":10,"rationale":"Build, lint, and tests all pass; dependencies are pinned with a lockfile; deterministic game/data rules are separated from the rendering layer and covered by meaningful tests.","evidence":["results/evidence/monolith/build.exit-code contains 0 and build.log reports a successful Vite production build; lint.exit-code contains 0 and test.exit-code contains 0.","results/evidence/monolith/test.log reports 1 test file and 4 passing tests covering validation, bounded scores, difficulty escalation, collisions, and enemy scoring.","package.json:7-20 pins dependency versions and defines check scripts; package-lock.json:4 and package entries provide lockfileVersion 3 with resolved integrity records; src/gameLogic.js and src/main.js separate deterministic rules from UI/game-loop code."]},"reproducibility":{"awarded":7,"rationale":"The handoff is reproducible from the checked-in source: README covers setup, controls, architecture, security, deployment, and verification; the migration, lockfile, Vite/Workers configuration, and source manifest are present.","evidence":["README.md:5-17 documents local setup and migration usage; lines 19-47 document controls, architecture, offline behavior, and security decisions; lines 49-66 document build, Wrangler deployment, and production smoke verification.","supabase/migrations/20260805143000_create_leaderboard.sql is a complete schema/policy artifact; package-lock.json, vite.config.js, wrangler.jsonc, and src/worker.js provide pinned build/deployment inputs.","results/evidence/monolith/source-manifest.txt lists the retained source, migration, configuration, lockfile, and built artifacts; automated.json marks the result artifact valid."]},"manual_points":46,"summary":"Manual score: 46/46. The retained automated evaluator separately awarded 54/54, for 100 total."}