{"combat_progression":{"awarded":4,"rationale":"The standalone engine demonstrates meaningful combat depth, but it is not wired into the browser application.","evidence":[".worktrees/neon-barrage/src/game-engine.ts:243-245 reduces spawn interval as score rises.",".worktrees/neon-barrage/src/game-engine.ts:327-352 implements three enemy variants, score-based speed, projectile collisions, and scoring.",".worktrees/neon-barrage/src/game-engine.ts:358-405 implements lives, damage, game over, and restart state.",".worktrees/neon-barrage/tests/game-engine.test.ts:33-166 covers hits, game over, pacing, reset, spawning, swept collision, and bounds.",".worktrees/neon-barrage/src/main.ts:1 is only `export {}`, so the engine is not connected to a playable page."]},"visual_design":{"awarded":0,"rationale":"No implemented renderer, styling, or screenshot evidence is present.","evidence":[".worktrees/neon-barrage/src/main.ts:1 contains no canvas or UI implementation.",".worktrees/neon-barrage/index.html:8-10 contains only an empty app mount and module entry.","The evidence directory contains no screenshot files."]},"resilience_accessibility":{"awarded":0,"rationale":"Only basic document metadata exists; no implemented controls, status states, focus behavior, or loading/error handling is evidenced.","evidence":[".worktrees/neon-barrage/index.html:2-5 provides only the document language, charset, and viewport metadata.",".worktrees/neon-barrage/src/main.ts:1 provides no accessible UI or resilience behavior."]},"data_security":{"awarded":0,"rationale":"The required checked-in migration and remote security verification are absent, so no Supabase/RLS points can be awarded.","evidence":["No `supabase/` directory or migration SQL exists in the candidate worktree.",".worktrees/neon-barrage/src/main.ts:1 contains no Supabase integration; only the unused dependency is declared in package.json:12-13.","results/evidence/dynamic_luna_max_opencode_superpowers/automated.json reports an empty `supabase_requests` array and stops because the result artifact is missing."]},"engineering_quality":{"awarded":4,"rationale":"The engine is strongly typed, modular, and meaningfully tested, with strict TypeScript settings and pinned dependencies; the overall deliverable is incomplete and the browser build is only an empty shell.","evidence":[".worktrees/neon-barrage/src/game-engine.ts:1-450 is a DOM-free typed engine with bounded updates, swept collision handling, and state isolation.",".worktrees/neon-barrage/tests/game-engine.test.ts:1-167 contains 14 focused gameplay tests.",".worktrees/neon-barrage/tsconfig.json:6-14 enables strict/no-unused/no-emit checking.",".worktrees/neon-barrage/package.json:6-20 pins the toolchain and defines test, typecheck, and build scripts; package-lock.json is present.",".worktrees/neon-barrage/.superpowers/sdd/2026-08-06-neon-barrage/task-2-report.md:85-98 records reported test, typecheck, build, and diff-check passes, but the final browser entry remains a no-op.","results/evidence/dynamic_luna_max_opencode_superpowers/browser-evaluator.log reports that evaluation stopped because benchmark-result.json was absent."]},"reproducibility":{"awarded":1,"rationale":"The pinned lockfile and scaffold are reproducible evidence, but the required handoff materials and verification artifacts are missing.","evidence":[".worktrees/neon-barrage/package-lock.json:1-18 records lockfile version 3 and exact direct dependency versions.",".worktrees/neon-barrage/.superpowers/sdd/2026-08-06-neon-barrage/progress.md:5-9 marks only Tasks 1-2 complete and Tasks 3-7 pending.","No README.md, Supabase migration, or benchmark-result.json exists in the candidate worktree.","results/evidence/dynamic_luna_max_opencode_superpowers/automated.json records ENOENT for benchmark-result.json and no live verification."]},"manual_points":9,"summary":"Manual total: 9/46. Evidence supports a tested standalone game engine and pinned scaffold, but not a delivered browser game, visual UI, Supabase security, or complete handoff."}