{"combat_progression":{"awarded":5,"rationale":"Full credit for meaningful enemy variety, collisions, scoring, escalating threat, lives, and game-over progression.","evidence":["src/app.js:135-225 defines drone/orb/hunter enemies, hunter hit points, score rewards and penalties, difficulty-dependent spawning, collisions, life loss, and game over.","src/game-state.js:19-24 and tests/game-state.test.js:14-18 cover score-based difficulty escalation and capping.","automated.json reports enemyCount 4 and a gameover transition with score 7317."]},"visual_design":{"awarded":12,"rationale":"The screenshots show a polished, coherent neon arcade presentation with strong hierarchy, feedback styling, and responsive composition.","evidence":["desktop-before.png visibly shows consistent cyan/pink/lime art direction, scanline treatment, HUD hierarchy, framed canvas, overlay typography, and leaderboard panel.","desktop-after.png visibly shows the live starfield canvas, glowing player ship, enemy, HUD, and populated leaderboard.","mobile.png visibly shows a fitted single-column layout with directional controls, FIRE control, readable HUD, and leaderboard.","src/app.js:231-276 implements gradients, stars, grid, glow, particles, screen shake, flash feedback, and animated ship effects; src/styles.css:17 and 30-40 defines the visual system and mobile breakpoints."]},"resilience_accessibility":{"awarded":2,"rationale":"Full remaining credit for explicit loading, empty, validation, and network-error states plus semantic labels and live error/status messaging.","evidence":["src/app.js:310-335 handles configuration-pending, loading, empty, fetch-error, name validation, and submission-error states.","index.html:45-74 uses labels, aria-describedby, role=alert, role=status, aria-labels, and accessible control names.","automated.json reports 7 labeled elements and zero console/page errors."]},"data_security":{"awarded":10,"rationale":"The checked-in schema applies database-side validation and RLS, limits public grants to select/insert, and the browser uses only the public anon credential; live evaluator requests confirm the configured remote round trip.","evidence":["supabase/migrations/001_leaderboard.sql:2-14 defines constrained leaderboard columns, an index, and enables RLS.","supabase/migrations/001_leaderboard.sql:16-30 restricts policies and grants to validated public select/insert, with no update/delete grants.","src/config.js:1-3 contains only the Supabase URL and public anon key; src/app.js:320-330 submits through the anon REST path with client-side validation and HTML escaping.","automated.json records real Supabase GET 200 and POST 201 requests, plus persisted reload reads."]},"engineering_quality":{"awarded":9,"rationale":"Strong dependency-free structure, syntax checking, meaningful helper tests, and a clear separation between game-state helpers and the browser app; one point is withheld for limited candidate-owned integration coverage and no separate retained build log.","evidence":["test.log records five passing Node tests covering initial state, bounded movement, difficulty, input validation, and collision detection.","package.json:6-8 defines npm test and source syntax-check commands; package-lock.json:1-12 is a valid lockfile for the dependency-free package.","README.md:23-28 documents the source responsibilities and automated-test surface.","browser-evaluator.log reports zero console and page errors during the deployed smoke flow."]},"reproducibility":{"awarded":7,"rationale":"Complete handoff beyond the result artifact: source, migration, lockfile, setup, deployment, controls, architecture, security decisions, and verification procedure are all documented.","evidence":["README.md:5-15 documents local setup and configuration; README.md:17-28 documents controls and architecture.","README.md:30-43 gives Cloudflare deployment, Supabase migration, security, and verification instructions.","supabase/migrations/001_leaderboard.sql is a reproducible schema/policy migration, and source-manifest.txt lists the retained source, tests, migration, README, and lockfile."]},"manual_points":45,"summary":"Manual score: 45/46. The candidate is visually polished, functionally deep, secure, and well documented; the only deduction is for limited retained candidate-owned integration/build evidence."}