{"combat_progression":{"awarded":5,"rationale":"Source implements meaningful combat and progression depth beyond the automated baseline.","evidence":["src/game/engine.ts:127-162 scales enemy speed/spawn timing with elapsed time and score, and defines scout, drifter, and bruiser enemy types with different health and rewards.","src/game/engine.ts:279-305 implements projectile collisions, score awards, particles, player damage, lives, and game-over transition.","automated.json records live enemy spawning with enemyCount 3 and HUD state with lives 3."]},"visual_design":{"awarded":12,"rationale":"The screenshots and rendering/CSS source show a cohesive, polished neon arcade presentation with responsive layout and feedback effects.","evidence":["desktop-after.png visibly shows a glowing cyan ship, gridded blue-violet playfield, neon HUD, styled panels, and readable leaderboard.","mobile.png visibly shows a clean stacked layout with usable d-pad and FIRE controls, readable controls text, and leaderboard fitting the narrow viewport.","src/style.css:1-18, 59-81, 174-187, and 300-345 define the consistent palette, glow treatment, panel hierarchy, and mobile breakpoints.","src/game/engine.ts:317-426 renders gradients, grid, stars, glows, enemy silhouettes, particles, player animation, and menu/game-over overlays."]},"resilience_accessibility":{"awarded":2,"rationale":"Loading, empty, network-error, validation, and labeled-control paths are present, with clean browser execution evidence.","evidence":["src/main.ts:229-243 renders loading, empty, and network-error leaderboard states; src/main.ts:261-285 validates callsigns and handles submission errors.","src/main.ts:39-52 and 70-81 provide labeled touch controls, form labeling, and named buttons.","automated.json reports six labeled elements and zero console or page errors."]},"data_security":{"awarded":10,"rationale":"The migration provides RLS, constrained public permissions, and database-side validation; the deployed anon path has retained successful remote read/insert evidence.","evidence":["supabase/migrations/20260807180000_leaderboard.sql:3-21 defines typed columns, name/score constraints, an index, and enables RLS.","supabase/migrations/20260807180000_leaderboard.sql:23-45 grants only SELECT/INSERT table access to anon/authenticated and defines matching RLS policies with database-side checks.","src/config.ts:1-8 and src/leaderboard.ts:39-79 use the Supabase URL and anon key only, with client-side validation before insert.","automated.json records live Supabase GET 200 and POST 201 requests plus subsequent reads from the deployed UI."]},"engineering_quality":{"awarded":9,"rationale":"Build hygiene and structure are strong, with one point withheld for shallow coverage of collision/progression and network-service behavior.","evidence":["build.exit-code is 0 and build.log reports successful TypeScript compilation and Vite production build.","lint.exit-code and typecheck.exit-code are 0; both logs show successful no-emit checks.","test.log reports 2 test files and 9 passing tests; src/game/engine.test.ts covers startup, movement, adapter, spawning, and firing, while src/leaderboard.test.ts covers validation.","package.json pins direct dependency versions and package-lock.json is present with lockfileVersion 3."]},"reproducibility":{"awarded":7,"rationale":"The handoff is reproducible from the source tree without relying on the result artifact alone.","evidence":["README.md:5-21 documents installation, local development, build, test, lint, and typecheck commands.","README.md:30-79 documents module ownership, adapter behavior, deployment steps, migration use, and security decisions.","supabase/migrations/20260807180000_leaderboard.sql is a checked-in schema/policy migration; package-lock.json pins the dependency graph.","wrangler.toml defines the Pages project and build output, and source-manifest.txt retains the source, README, migration, and build artifacts."]},"manual_points":45,"summary":"Evidence supports 45/46 manual points; the only deduction is for limited automated coverage of collision/progression and network-service behavior."}