{"combat_progression":{"awarded":5,"rationale":"Strong combat depth with multiple enemy archetypes, enemy projectiles, collisions, score awards, lives, and score-driven difficulty escalation.","evidence":["src/game.js:221-256 defines scout, weaver, and tank enemies with differing movement, health, and firing behavior.","src/game.js:316-391 implements spawning, projectile collisions, damage, score awards, and wave progression.","src/game-logic.js:16-26 and tests/game-logic.test.js:16-24 verify escalating difficulty; test.log records four passing tests."]},"visual_design":{"awarded":9,"rationale":"Cohesive, polished neon arcade art direction with strong desktop hierarchy, animated canvas effects, and responsive mobile controls. Deducted for visible contradictory leaderboard states and clipped mobile start overlay.","evidence":["desktop-before.png and desktop-after.png show a consistent cyan/pink neon palette, grid and scanline treatment, glowing HUD, structured panels, and clear typography.","desktop-after.png and mobile.png visibly show populated leaderboard rows simultaneously with No signals yet and RETRY SYNC.","mobile.png shows the responsive stacked layout and touch controls, but the initial ENTER THE title is clipped and the start affordance is not visible."]},"resilience_accessibility":{"awarded":1,"rationale":"Loading, offline, error, retry, validation, focus, and live-region paths are present, but the retained screenshots expose contradictory state rendering and a clipped initial mobile overlay.","evidence":["src/game.js:639-713 implements loading, offline, network-error, empty, and retry leaderboard states.","src/index.html:47,60-64,78-85,112-120 provides a focusable labeled canvas, labeled input, live regions, and labeled touch controls.","browser-evaluator.log records empty console_errors and page_errors; desktop-after.png and mobile.png show the remaining state/readability defects."]},"data_security":{"awarded":9,"rationale":"The checked-in migration provides RLS, restrictive anon grants, insert/select-only policies, database validation constraints, and no privileged browser credential. Live evidence confirms the anon read/insert path; one point is withheld because retained remote evidence does not explicitly test invalid inserts or denied update/delete operations.","evidence":["supabase/migrations/20260807000000_create_leaderboard.sql:2-17 defines constrained schema, index, and RLS; lines 19-40 define anon select/insert policies and grants with public privileges revoked.","src/game.js:693-699 and 738-746 send only the configured anon key for leaderboard reads and inserts.","automated.json and browser-evaluator.log record live Supabase GET 200, POST 201, subsequent GET 200, and persisted leaderboard data."]},"engineering_quality":{"awarded":8,"rationale":"Clean dependency-free modular implementation with a dedicated DOM-free logic module, build/check/test scripts, and a valid lockfile. Coverage is meaningful but limited to four helper tests with no end-to-end combat, SQL, or failure-path tests.","evidence":["package.json:7-11 defines build, syntax check, test, and verify commands.","build.log and test.log show a successful build and four passing Node tests; both exit-code files contain 0.","src/game-logic.js and tests/game-logic.test.js separate and exercise collision, difficulty, name, and score helpers.","package-lock.json:1-12 is a valid lockfileVersion 3 artifact for the dependency-free package."]},"reproducibility":{"awarded":7,"rationale":"Complete non-result-artifact handoff: README setup, controls, architecture, deployment, and security guidance; reproducible migration; build script; source tree; lockfile; and retained verification logs.","evidence":["README.md:5-16 documents local setup and offline behavior; lines 18-34 document controls and architecture; lines 36-56 document Supabase, Cloudflare Pages, and verification.","supabase/migrations/20260807000000_create_leaderboard.sql reproduces the leaderboard schema, constraints, policies, and grants.","scripts/build.mjs, package.json, package-lock.json, source-manifest.txt, build.log, and test.log provide the build inputs and retained verification handoff."]},"manual_points":39,"summary":"Manual score: 39/46. The candidate has strong combat depth, polished visual design, robust SQL controls, and a complete handoff, with deductions for visible UI state defects, limited automated coverage, and missing retained negative remote security checks."}